{
  "$schema": "https://json-schema.org/draft/2020-12/schema",
  "$id": "https://hunkybrewstersmisfitmusicproject.github.io/misfit-music-discovery/manifest.schema.json",
  "title": "Misfit Music Project — Artist Manifest",
  "description": "Canonical schema for an artist manifest in the Misfit Music Discovery index. Artists own their manifests; this schema keeps the index consistent and machine-validatable.",
  "type": "object",
  "required": ["manifest_version", "generated_at", "name", "location", "genres", "bio", "links"],
  "additionalProperties": false,
  "properties": {
    "manifest_version": {
      "type": "string",
      "pattern": "^\\d+\\.\\d+\\.\\d+$",
      "description": "Semver of the manifest schema. Bump when the schema changes."
    },
    "generated_at": {
      "type": "string",
      "format": "date-time",
      "description": "ISO-8601 timestamp of when this manifest was last generated/updated."
    },
    "name": {
      "type": "string",
      "minLength": 1,
      "description": "Artist or project name."
    },
    "location": {
      "type": "string",
      "description": "Human-readable location, e.g. 'Tokyo, Japan' or 'Portland, Oregon'."
    },
    "genres": {
      "type": "array",
      "minItems": 1,
      "items": { "type": "string", "minLength": 1 },
      "description": "Genre tags used for search and filtering."
    },
    "bio": {
      "type": "string",
      "description": "Short artist description. Plain text; HTML is not rendered."
    },
    "contact": {
      "type": ["string", "null"],
      "description": "Optional contact email. Omit or null if none."
    },
    "links": {
      "type": "array",
      "items": {
        "type": "object",
        "required": ["kind", "url"],
        "additionalProperties": false,
        "properties": {
          "kind": {
            "type": "string",
            "enum": ["bandcamp", "spotify", "soundcloud", "youtube", "website", "instagram", "other"],
            "description": "Platform or link type."
          },
          "url": { "type": "string", "format": "uri" }
        }
      },
      "description": "Listening/purchase links."
    },
    "preview": {
      "type": ["string", "null"],
      "description": "Optional path to a short audio clip, e.g. 'previews/<name>.wav'. Null/empty if not available; the site shows 'preview pending'."
    },
    "releases": {
      "type": "array",
      "description": "Optional list of releases. Omit entirely when empty.",
      "items": { "type": "object", "additionalProperties": true }
    }
  }
}
