{
  "manifest_version": "0.2.0",
  "generated_at": "2026-07-31T00:00:00+00:00",
  "name": "GIRL K",
  "location": "Chicago, Illinois",
  "genres": [
    "indie pop"
  ],
  "bio": "Indie Pop artist from Chicago, Illinois. (bio sourced from public Bandcamp listing.)",
  "contact": "girlkmusic@gmail.com",
  "links": [
    {
      "kind": "bandcamp",
      "url": "https://girlk.bandcamp.com/music"
    }
  ],
  "preview": null
}
