{
  "manifest_version": "0.2.0",
  "generated_at": "2026-07-31T00:00:00+00:00",
  "name": "Purr Tapes",
  "location": "Portland, Oregon",
  "genres": [
    "electronic",
    "experimental"
  ],
  "bio": "DIY tape label based in Portland, OR. Releases independent artists with a focus on electronic and experimental sounds. (bio sourced from public Bandcamp listing.)",
  "contact": null,
  "links": [
    {
      "kind": "bandcamp",
      "url": "https://purrtapes.bandcamp.com/"
    }
  ],
  "preview": null
}
