{
  "manifest_version": "0.2.0",
  "generated_at": "2026-07-31T00:00:00+00:00",
  "name": "Arch Cape",
  "location": "Portland, Oregon",
  "genres": [
    "ambient",
    "experimental",
    "indie",
    "soundscape"
  ],
  "bio": "Ambient/experimental film music, soundscape composition. (bio sourced from public Bandcamp listing.)",
  "contact": null,
  "links": [
    {
      "kind": "bandcamp",
      "url": "https://arch-cape.bandcamp.com/"
    }
  ],
  "preview": null
}
