{
  "manifest_version": "0.2.0",
  "generated_at": "2026-08-02T00:00:00+00:00",
  "name": "Chrome Reverb",
  "location": "London, UK",
  "genres": [
    "synthwave",
    "darkwave",
    "electronic"
  ],
  "bio": "Cold, reverb-drenched synthwave with triangle-wave bass and industrial undertones.",
  "contact": "contact@chromereverb.co.uk",
  "links": [
    {
      "kind": "bandcamp",
      "url": "https://chromereverb.bandcamp.com/"
    },
    {
      "kind": "website",
      "url": "https://chromereverb.com"
    }
  ],
  "preview": "previews/chrome-reverb.wav"
}
