{
  "manifest_version": "0.2.0",
  "generated_at": "2026-07-31T00:00:00+00:00",
  "name": "Belonging",
  "location": "Portland, Oregon",
  "genres": [
    "indie",
    "noise",
    "punk",
    "emo"
  ],
  "bio": "Portland indie/noise/punk/emo. (bio sourced from public Bandcamp listing.)",
  "contact": null,
  "links": [
    {
      "kind": "bandcamp",
      "url": "https://belongingpdx.bandcamp.com/music"
    }
  ],
  "preview": null
}
