{
  "manifest_version": "0.2.0",
  "generated_at": "2026-08-02T00:00:00+00:00",
  "name": "Outrun Escape",
  "location": "Los Angeles, California",
  "genres": [
    "synthwave",
    "outrun",
    "electronic"
  ],
  "bio": "Retro-futuristic synthwave with warm analog textures and driving basslines. Inspired by 80s road movies and neon-lit highways.",
  "contact": "hello@outrunescape.fm",
  "links": [
    {
      "kind": "bandcamp",
      "url": "https://outrunescape.bandcamp.com/"
    },
    {
      "kind": "spotify",
      "url": "https://open.spotify.com/artist/outrunescape"
    }
  ],
  "preview": "previews/outrun-escape.wav"
}
